research/experiments/focused_1d_15d_smoke/results/final_comparison/horizon_1_full.csv

experiment_family,experiment_name,crop,horizon_days,validation_rows,validation_start,validation_end,mae,rmse,r2,mape_pct,wape_pct,display_name,graph_bucket,source_file,train_rows,target_mode,normalization_mode,feature_count,candidate_index,params_json,artifact_path,device,train_windows,validation_windows,target_encoding
baseline,current_price,onion,1,8678,2025-10-03,2025-12-31,100.50790726016088,214.4384188162546,0.9534936294855996,3.9697313288031575,3.761812624226144,current_price,non_graph,baseline_metrics/baseline_metrics.csv,,,,,,,,,,,
tabular_variant,histgb_delta_current_mean_center,onion,1,8678,2025-10-03,2025-12-31,138.62519499609778,227.94007550999356,0.9474529148242052,5.6015396445995735,5.188467482685668,histgb_delta_current_mean_center,non_graph,anchored_histgb_metrics/anchored_histgb_metrics.csv,10000.0,delta_current,series_mean_center,,,,,,,,
tabular_variant,histgb_cross_crop_delta_current_mean_center,onion,1,8678,2025-10-03,2025-12-31,141.2481374127977,229.63289610334095,0.9466695238715154,5.640987886586359,5.286639041170312,histgb_cross_crop_delta_current_mean_center,non_graph,cross_crop_histgb_metrics/cross_crop_histgb_metrics.csv,10000.0,delta_current,series_mean_center,,,,,,,,
classical_ml,linear_regression,onion,1,8678,2025-10-03,2025-12-31,160.1268042916517,235.4325623097924,0.9439416496716544,6.681546554380327,5.99323028686808,linear_regression,non_graph,classical_ml_metrics/classical_ml_metrics.csv,20000.0,,,33.0,,,,,,,
classical_ml,ridge_alpha_10,onion,1,8678,2025-10-03,2025-12-31,161.29653425555745,236.22640019957197,0.9435629742043422,6.753228053095454,6.037010971046155,ridge_alpha_10,non_graph,classical_ml_metrics/classical_ml_metrics.csv,20000.0,,,33.0,,,,,,,
classical_ml,elasticnet_a001_l05,onion,1,8678,2025-10-03,2025-12-31,170.21893613059987,242.90100801047348,0.9403286464891352,7.307731524306739,6.370958865564279,elasticnet_a001_l05,non_graph,classical_ml_metrics/classical_ml_metrics.csv,20000.0,,,33.0,,,,,,,
simple_model,numeric_histgb_simple,onion,1,8678,2025-10-03,2025-12-31,165.5447386830132,245.10640030393455,0.9392401688230636,6.781568233412082,6.196012879265479,numeric_histgb_simple,non_graph,simple_numeric_metrics/simple_numeric_metrics.csv,20000.0,,,,,,,,,,
baseline,previous_day_price,onion,1,8678,2025-10-03,2025-12-31,152.30108213895642,284.6825741498773,0.9180348905627916,6.184554978197416,5.700328950145451,previous_day_price,non_graph,baseline_metrics/baseline_metrics.csv,,,,,,,,,,,
baseline,roll_mean_7,onion,1,8678,2025-10-03,2025-12-31,252.63602596248083,363.1752571868298,0.8666049358270834,10.905424582770372,9.455667894268151,roll_mean_7,non_graph,baseline_metrics/baseline_metrics.csv,,,,,,,,,,,
baseline,roll_mean_28,onion,1,8678,2025-10-03,2025-12-31,432.81262186877944,516.0222325631546,0.7306952078267028,20.363397908459493,16.19932231457134,roll_mean_28,non_graph,baseline_metrics/baseline_metrics.csv,,,,,,,,,,,
classical_ml,elasticnet_a001_l05,potato,1,4113,2025-09-02,2025-11-30,127.44339585176444,248.3241144497525,0.970455609977973,4.529370153131881,4.854419043916258,elasticnet_a001_l05,non_graph,classical_ml_metrics/classical_ml_metrics.csv,20000.0,,,33.0,,,,,,,
classical_ml,ridge_alpha_10,potato,1,4113,2025-09-02,2025-11-30,126.4818269930535,249.39032781469905,0.9702013596030012,4.536483058100375,4.817792130857597,ridge_alpha_10,non_graph,classical_ml_metrics/classical_ml_metrics.csv,20000.0,,,33.0,,,,,,,
classical_ml,linear_regression,potato,1,4113,2025-09-02,2025-11-30,126.83619327564456,249.66190766916455,0.9701364243116186,4.548035599021122,4.831290220885993,linear_regression,non_graph,classical_ml_metrics/classical_ml_metrics.csv,20000.0,,,33.0,,,,,,,
baseline,current_price,potato,1,4113,2025-09-02,2025-11-30,101.79922020310896,275.05977448059855,0.9637513862770032,3.3753744817051587,3.8776122521452336,current_price,non_graph,baseline_metrics/baseline_metrics.csv,,,,,,,,,,,
tabular_variant,histgb_cross_crop_delta_current_mean_center,potato,1,4113,2025-09-02,2025-11-30,148.0735388695907,287.8553638855296,0.9603004220216536,4.94677570377242,5.640237394683826,histgb_cross_crop_delta_current_mean_center,non_graph,cross_crop_histgb_metrics/cross_crop_histgb_metrics.csv,10000.0,delta_current,series_mean_center,,,,,,,,
tabular_variant,histgb_delta_current_mean_center,potato,1,4113,2025-09-02,2025-11-30,148.38426777027,288.1329121247972,0.960223828972809,4.927782864975519,5.652073302561761,histgb_delta_current_mean_center,non_graph,anchored_histgb_metrics/anchored_histgb_metrics.csv,10000.0,delta_current,series_mean_center,,,,,,,,
simple_model,numeric_histgb_simple,potato,1,4113,2025-09-02,2025-11-30,146.60718377382943,308.6860238917159,0.9543468056380068,4.863070180156435,5.584382777389363,numeric_histgb_simple,non_graph,simple_numeric_metrics/simple_numeric_metrics.csv,20000.0,,,,,,,,,,
baseline,previous_day_price,potato,1,4113,2025-09-02,2025-11-30,134.16449958870268,317.16201346754707,0.9518052679998412,4.475320308954942,5.110431164110229,previous_day_price,non_graph,baseline_metrics/baseline_metrics.csv,,,,,,,,,,,
baseline,roll_mean_7,potato,1,4113,2025-09-02,2025-11-30,172.2375583674744,318.1551778087352,0.9515029604715384,6.170054497078513,6.560663876135485,roll_mean_7,non_graph,baseline_metrics/baseline_metrics.csv,,,,,,,,,,,
baseline,roll_mean_28,potato,1,4113,2025-09-02,2025-11-30,226.0212411184847,360.3902991478245,0.937772346947066,8.669552939907293,8.609326594619066,roll_mean_28,non_graph,baseline_metrics/baseline_metrics.csv,,,,,,,,,,,
classical_ml,linear_regression,tomato,1,29374,2025-10-03,2025-12-31,258.3711745269611,433.33712723336953,0.9042919640544947,8.360840266773732,8.148971978444706,linear_regression,non_graph,classical_ml_metrics/classical_ml_metrics.csv,20000.0,,,33.0,,,,,,,
classical_ml,ridge_alpha_10,tomato,1,29374,2025-10-03,2025-12-31,258.34345840921384,433.3405847554963,0.9042904367726105,8.359708026561135,8.148097817976584,ridge_alpha_10,non_graph,classical_ml_metrics/classical_ml_metrics.csv,20000.0,,,33.0,,,,,,,
classical_ml,elasticnet_a001_l05,tomato,1,29374,2025-10-03,2025-12-31,259.1744619261499,434.2264762661704,0.9038987127560016,8.374436877858107,8.17430749243388,elasticnet_a001_l05,non_graph,classical_ml_metrics/classical_ml_metrics.csv,20000.0,,,33.0,,,,,,,
simple_model,numeric_histgb_simple,tomato,1,29374,2025-10-03,2025-12-31,258.36275338193576,450.4966865961841,0.8965620734344257,8.12229366594618,8.148706377318868,numeric_histgb_simple,non_graph,simple_numeric_metrics/simple_numeric_metrics.csv,20000.0,,,,,,,,,,
tabular_variant,histgb_delta_current_mean_center,tomato,1,29374,2025-10-03,2025-12-31,263.23370048646603,451.3503308668801,0.8961696938458534,8.316234685386716,8.30233501463097,histgb_delta_current_mean_center,non_graph,anchored_histgb_metrics/anchored_histgb_metrics.csv,10000.0,delta_current,series_mean_center,,,,,,,,
tabular_variant,histgb_cross_crop_delta_current_mean_center,tomato,1,29374,2025-10-03,2025-12-31,263.5381757981143,451.4056917596202,0.8961442214330898,8.310027044133705,8.311938101303824,histgb_cross_crop_delta_current_mean_center,non_graph,cross_crop_histgb_metrics/cross_crop_histgb_metrics.csv,10000.0,delta_current,series_mean_center,,,,,,,,
baseline,current_price,tomato,1,29374,2025-10-03,2025-12-31,239.0287382686688,469.70354729976873,0.8875539292211889,7.830139306742269,7.538915646300621,current_price,non_graph,baseline_metrics/baseline_metrics.csv,,,,,,,,,,,
baseline,previous_day_price,tomato,1,29374,2025-10-03,2025-12-31,312.9959858643454,551.9059184326277,0.8447517523347337,9.990967973037035,9.87182692823216,previous_day_price,non_graph,baseline_metrics/baseline_metrics.csv,,,,,,,,,,,
baseline,roll_mean_7,tomato,1,29374,2025-10-03,2025-12-31,412.5067385307674,626.808321145534,0.7997529574005012,12.662212028649297,13.010374935831187,roll_mean_7,non_graph,baseline_metrics/baseline_metrics.csv,,,,,,,,,,,
baseline,roll_mean_28,tomato,1,29374,2025-10-03,2025-12-31,554.3618911578085,841.1528633060452,0.6393827813225459,16.589046209578527,17.48445632618818,roll_mean_28,non_graph,baseline_metrics/baseline_metrics.csv,,,,,,,,,,,
focused_tabular,extratrees_tuned,wheat,1,528,2025-09-02,2025-11-30,32.41940978629935,50.34262547705582,0.7934862280746438,1.2818154818468996,1.2780964134136583,extratrees_tuned,non_graph,expanded_model_metrics/expanded_model_metrics.csv,20000.0,,,33.0,3.0,"{""max_depth"": 24, ""max_features"": ""sqrt"", ""min_samples_leaf"": 1, ""n_estimators"": 300}",artifacts/extratrees/wheat/wheat_extratrees_1d.joblib,,,,
simple_model,numeric_histgb_simple,wheat,1,528,2025-09-02,2025-11-30,32.20690983778691,51.094581546796896,0.7872708571942144,1.2744657111490665,1.269718857380571,numeric_histgb_simple,non_graph,simple_numeric_metrics/simple_numeric_metrics.csv,20000.0,,,,,,,,,,
classical_ml,linear_regression,wheat,1,528,2025-09-02,2025-11-30,33.575220482001015,51.387426012124614,0.7848253894353877,1.3277645574072423,1.3236628661806586,linear_regression,non_graph,classical_ml_metrics/classical_ml_metrics.csv,20000.0,,,33.0,,,,,,,
classical_ml,ridge_alpha_10,wheat,1,528,2025-09-02,2025-11-30,33.65299280559033,51.4580093151155,0.7842338764336767,1.3310245164011816,1.326728946917402,ridge_alpha_10,non_graph,classical_ml_metrics/classical_ml_metrics.csv,20000.0,,,33.0,,,,,,,
classical_ml,elasticnet_a001_l05,wheat,1,528,2025-09-02,2025-11-30,33.75485477314786,51.63141114125592,0.7827772604822326,1.3353965755240071,1.3307447330238336,elasticnet_a001_l05,non_graph,classical_ml_metrics/classical_ml_metrics.csv,20000.0,,,33.0,,,,,,,
tabular_variant,histgb_cross_crop_delta_current_mean_center,wheat,1,528,2025-09-02,2025-11-30,36.13605545475538,55.04976876915337,0.7530617904906397,1.425974707973217,1.424620718763305,histgb_cross_crop_delta_current_mean_center,non_graph,cross_crop_histgb_metrics/cross_crop_histgb_metrics.csv,10000.0,delta_current,series_mean_center,,,,,,,,
baseline,roll_mean_7,wheat,1,528,2025-09-02,2025-11-30,35.31470977801961,55.05455982449456,0.7530188058918947,1.387359005214856,1.3922401488970262,roll_mean_7,non_graph,baseline_metrics/baseline_metrics.csv,,,,,,,,,,,
baseline,roll_mean_7,wheat,1,528,2025-09-02,2025-11-30,35.31470977801961,55.05455982449456,0.7530188058918947,1.387359005214856,1.3922401488970262,roll_mean_7,non_graph,baseline_metrics/baseline_metrics.csv,,,,,,,,,,,
tabular_variant,histgb_delta_current_mean_center,wheat,1,528,2025-09-02,2025-11-30,36.71340717500732,55.38642727780492,0.7500322390509527,1.44968979431544,1.4473821190416056,histgb_delta_current_mean_center,non_graph,anchored_histgb_metrics/anchored_histgb_metrics.csv,10000.0,delta_current,series_mean_center,,,,,,,,
baseline,current_price,wheat,1,528,2025-09-02,2025-11-30,33.90653022450624,61.80241040936063,0.688765219055006,1.3450010435462398,1.3367243560848916,current_price,non_graph,baseline_metrics/baseline_metrics.csv,,,,,,,,,,,
baseline,current_price,wheat,1,528,2025-09-02,2025-11-30,33.90653022450624,61.80241040936063,0.688765219055006,1.3450010435462398,1.3367243560848916,current_price,non_graph,baseline_metrics/baseline_metrics.csv,,,,,,,,,,,
baseline,previous_day_price,wheat,1,528,2025-09-02,2025-11-30,36.178604483830526,62.08377076578217,0.6859249265484453,1.433081061468833,1.4262981632884724,previous_day_price,non_graph,baseline_metrics/baseline_metrics.csv,,,,,,,,,,,
baseline,previous_day_price,wheat,1,528,2025-09-02,2025-11-30,36.178604483830526,62.08377076578217,0.6859249265484453,1.433081061468833,1.4262981632884724,previous_day_price,non_graph,baseline_metrics/baseline_metrics.csv,,,,,,,,,,,
baseline,roll_mean_28,wheat,1,528,2025-09-02,2025-11-30,47.52955410541937,68.23072745975132,0.620652435666829,1.860149071986566,1.873795761049269,roll_mean_28,non_graph,baseline_metrics/baseline_metrics.csv,,,,,,,,,,,
baseline,roll_mean_28,wheat,1,528,2025-09-02,2025-11-30,47.52955410541937,68.23072745975132,0.620652435666829,1.860149071986566,1.873795761049269,roll_mean_28,non_graph,baseline_metrics/baseline_metrics.csv,,,,,,,,,,,
focused_temporal,tcn_tuned,wheat,1,528,2025-09-02,2025-11-30,63.65019989013672,84.7078994111898,0.415310800075531,2.511012554168701,2.5093326568603516,tcn_tuned,non_graph,expanded_model_metrics/expanded_model_metrics.csv,,,,,2.0,"{""batch_size"": 128, ""dropout"": 0.2, ""epochs"": 10, ""hidden_channels"": 48, ""kernel_size"": 3, ""learning_rate"": 0.0007, ""weight_decay"": 1e-05, ""window_size"": 28}",artifacts/tcn/wheat/wheat_tcn_1d.pt,cpu,2000.0,528.0,log_delta_current
focused_tabular,mlp_tuned,wheat,1,528,2025-09-02,2025-11-30,81.60040786227076,109.56077834023183,0.0218904157888244,3.2281147525603404,3.21699837564393,mlp_tuned,non_graph,expanded_model_metrics/expanded_model_metrics.csv,20000.0,,,33.0,2.0,"{""alpha"": 0.0005, ""hidden_layer_sizes"": [256, 128], ""learning_rate_init"": 0.0008, ""max_iter"": 300}",artifacts/mlp/wheat/wheat_mlp_1d.joblib,,,,

research/experiments/targeted_rebuild/reports/comprehensive_report.md

### Previous-day baseline requested in `newtests.txt`

- onion: `current_price = 0.9535`
- potato: `current_price = 0.9638`
- tomato: `current_price = 0.8876`
- wheat: `roll_mean_7 = 0.7530`

## Simple Model Test

- `1d`:
  - onion: `0.9392`
  - potato: `0.9543`
  - tomato: `0.8966`
  - wheat: `0.7873`
- `15d`:
  - onion: `-0.0535`
  - potato: `0.9017`
  - tomato: `0.2647`
  - wheat: `0.6417`

## Shifted Or Baseline-Subtracted Target Test

- `1d` best anchored scores:
  - onion: `0.9475`
  - potato: `0.9602`
  - tomato: `0.8962`
  - wheat: `0.7500`
- `15d` best anchored scores:
  - onion: `0.7010`
  - potato: `0.9320`
  - tomato: `0.2640`
  - wheat: `0.6478`